{
  "schema_version": 6,
  "property_id": "FURAMA_DANANG",
  "classification": "synthetic_operational",
  "runtime_use": "offline_policy_migration_candidate_only",
  "reviewed_at": "2026-10-05",
  "production_status": "runtime_blocked_until_agent_domain_parity",
  "sla_semantics": "sla_minutes is the runtime target to first staff response/attendance for an accepted request. It is never a guarantee of physical completion.",
  "truth_boundary": "Official Furama sources determine property facts. Product-authored routing and SLA targets are internal workflow policy for the production prototype and must never be described as official Furama commitments. Current runtime policy authority remains config/agent-domain.json until an explicit migration validates exact service/slot/risk/authority parity.",
  "services": [
    {
      "service_code": "amenity_delivery",
      "department_id": "HOUSEKEEPING",
      "sla_minutes": 15,
      "escalation_after_minutes": 20,
      "priority_on_escalation": "high",
      "approval": "none",
      "runtime_dispatch_enabled": true,
      "routing_basis": "official_property_route_plus_industry_timing",
      "sla_basis": "industry_benchmark_resort_item_delivery_target_not_furama_sla",
      "timing": {
        "guest_acknowledgement": "immediate_after_workflow_commit",
        "first_staff_response_target_min": 3,
        "first_attendance_target_min": 15,
        "expected_resolution_window_min": [
          10,
          20
        ],
        "runtime_sla_clock": "first_attendance_or_first_staff_response",
        "completion_is_not_promised": true,
        "after_hours_handling": "queue_for_staff_when_available"
      },
      "access_model": "door_delivery_or_guest_handoff",
      "confidence": {
        "routing": 1.0,
        "timing": 0.82
      },
      "rationale": "Furama explicitly routes extra towels to Housekeeping. A 15-minute resort in-room item-delivery target is an industry benchmark, used here as a prototype target rather than an official Furama SLA.",
      "source_refs": [
        "furama_bath_towels",
        "benchmark_lqa_resort_delivery"
      ],
      "public_anchors": [
        "https://furamavietnam.com/furama-room-directory/room-directory/room-facilities-services/bath-towels/"
      ],
      "assumption_refs": [
        "asm_amenity_delivery_timing"
      ],
      "simulation_adjustments": {
        "apply_occupancy_multiplier": true,
        "apply_daypart_multiplier": true,
        "min_effective_sla_min": 11,
        "max_effective_sla_min": 27
      },
      "operational_variants": {
        "standard_item": {
          "expected_resolution_window_min": [
            10,
            20
          ],
          "benchmark": "LQA resort in-house item target 15 min"
        },
        "special_setup": {
          "expected_resolution_window_min": [
            30,
            60
          ],
          "examples": [
            "extra bed",
            "baby cot",
            "special celebration amenity"
          ]
        }
      },
      "staff_response_windows_local": [
        {
          "start": "00:00",
          "end": "24:00",
          "basis": "synthetic_night_runner_coverage"
        }
      ],
      "sla_clock_basis": "wall_clock",
      "required_slots": [
        "room_number"
      ],
      "optional_slots": [
        "quantity"
      ],
      "risk": "low",
      "reversible": true,
      "staff_verification_required": false,
      "confirmation": "none",
      "dedupe_window_minutes": 15,
      "modifiable_fields": [
        "room_number",
        "quantity"
      ]
    },
    {
      "service_code": "housekeeping",
      "department_id": "HOUSEKEEPING",
      "sla_minutes": 15,
      "escalation_after_minutes": 25,
      "priority_on_escalation": "high",
      "approval": "none",
      "runtime_dispatch_enabled": true,
      "routing_basis": "official_property_department_plus_industry_timing",
      "sla_basis": "industry_calibrated_first_attendance_target_not_cleaning_completion_sla",
      "timing": {
        "guest_acknowledgement": "immediate_after_workflow_commit",
        "first_staff_response_target_min": 3,
        "first_attendance_target_min": 15,
        "expected_resolution_window_min": null,
        "runtime_sla_clock": "first_attendance_or_first_staff_response",
        "completion_is_not_promised": true,
        "after_hours_handling": "queue_for_staff_when_available"
      },
      "access_model": "room_entry_subject_to_dnd_and_guest_access",
      "confidence": {
        "routing": 1.0,
        "timing": 0.68
      },
      "rationale": "Housekeeping is the verified department for room items. The runtime SLA is arrival/response, while cleaning duration is modeled separately using common stayover/check-out benchmarks.",
      "source_refs": [
        "furama_housekeeping",
        "benchmark_housekeeping_cleaning"
      ],
      "public_anchors": [
        "https://furamavietnam.com/room-directory/room-facilities-services/housekeeping/"
      ],
      "operational_variants": {
        "stayover_room_makeup": {
          "expected_completion_window_min": [
            20,
            30
          ]
        },
        "departure_room_clean": {
          "expected_completion_window_min": [
            30,
            45
          ],
          "runtime_guest_request_use": false
        }
      },
      "assumption_refs": [
        "asm_housekeeping_response_timing",
        "asm_housekeeping_cleaning_duration"
      ],
      "simulation_adjustments": {
        "apply_occupancy_multiplier": true,
        "apply_daypart_multiplier": true,
        "min_effective_sla_min": 11,
        "max_effective_sla_min": 27
      },
      "staff_response_windows_local": [
        {
          "start": "06:00",
          "end": "22:00",
          "basis": "synthetic_housekeeping_service_window"
        }
      ],
      "sla_clock_basis": "business_hours",
      "required_slots": [
        "room_number"
      ],
      "optional_slots": [
        "preferred_time"
      ],
      "risk": "low",
      "reversible": true,
      "staff_verification_required": false,
      "confirmation": "none",
      "dedupe_window_minutes": 15,
      "modifiable_fields": [
        "room_number",
        "preferred_time"
      ]
    },
    {
      "service_code": "maintenance",
      "department_id": "ENGINEERING",
      "sla_minutes": 15,
      "escalation_after_minutes": 20,
      "priority_on_escalation": "urgent",
      "approval": "none",
      "runtime_dispatch_enabled": true,
      "routing_basis": "synthetic_department_routing_with_property_feature_anchor",
      "sla_basis": "academic_case_calibrated_first_attendance_target_not_furama_sla",
      "timing": {
        "guest_acknowledgement": "immediate_after_workflow_commit",
        "first_staff_response_target_min": 5,
        "first_attendance_target_min": 15,
        "expected_resolution_window_min": [
          30,
          60
        ],
        "runtime_sla_clock": "first_attendance_or_first_staff_response",
        "completion_is_not_promised": true,
        "after_hours_handling": "queue_for_staff_when_available"
      },
      "access_model": "room_entry_subject_to_dnd_and_guest_access",
      "confidence": {
        "routing": 0.62,
        "timing": 0.66
      },
      "rationale": "Furama verifies air conditioning as an in-room feature but does not publish its Engineering SOP. Engineering routing is a conventional hotel assumption. The 15-minute first-attendance target and 30–60 minute typical repair-planning range are conservative prototype values calibrated from hotel-engineering literature. Dataset contract alignment 2026-10-05: routine maintenance is classified low-risk for the existing reversible/no-approval prototype path; safety exclusions remain on the emergency path. This is product-authored policy, not an official Furama risk classification.",
      "source_refs": [
        "furama_room_features",
        "benchmark_hotel_engineering_case"
      ],
      "public_anchors": [
        "https://furamavietnam.com/vi/rooms/garden-superior/"
      ],
      "operational_variants": {
        "air_conditioning": {
          "expected_resolution_window_min": [
            30,
            60
          ]
        },
        "minor_electrical": {
          "expected_resolution_window_min": [
            30,
            60
          ]
        },
        "minor_plumbing": {
          "expected_resolution_window_min": [
            30,
            60
          ]
        },
        "unresolved_after_60_min": {
          "action": "staff_review_for_alternative_room_or_extended_repair",
          "automatic_room_move": false
        },
        "priority_tiers": {
          "P1_safety": "emergency path, not routine maintenance",
          "P2_guest_comfort_high": {
            "attendance_target_min": 15,
            "resolution_window_min": [
              30,
              60
            ]
          },
          "P3_minor": {
            "attendance_target_min": 30,
            "resolution_window_min": [
              45,
              120
            ]
          }
        }
      },
      "safety_exclusions": [
        "fire_or_smoke",
        "burning_smell",
        "sparking_or_exposed_live_wiring",
        "major_flooding",
        "person_collapsed_or_injured"
      ],
      "assumption_refs": [
        "asm_engineering_route",
        "asm_maintenance_response_timing",
        "asm_maintenance_resolution_window"
      ],
      "simulation_adjustments": {
        "apply_occupancy_multiplier": true,
        "apply_daypart_multiplier": true,
        "min_effective_sla_min": 11,
        "max_effective_sla_min": 27
      },
      "staff_response_windows_local": [
        {
          "start": "00:00",
          "end": "24:00",
          "basis": "synthetic_engineering_on_call_coverage"
        }
      ],
      "sla_clock_basis": "wall_clock",
      "required_slots": [
        "room_number"
      ],